{
  "contract": "mograph-blender-job/1",
  "scene_id": "kit",
  "shot_id": "gallery",
  "plate_id": "kit",
  "out_dir": "C:/Users/perro/Desktop/MOTION/build/_tests/step13/fixture_kit_primitives",
  "frames": 12,
  "fps": 24,
  "width": 384,
  "height": 216,
  "transparent": true,
  "seed": 1152625918,
  "render": {
    "device": "CPU",
    "samples": 8,
    "adaptive_threshold": 0.02,
    "denoise": true,
    "view_transform": "AgX",
    "look": "Medium High Contrast",
    "exposure": 0,
    "bounces": { "total": 6, "diffuse": 3, "glossy": 3, "transmission": 4, "transparent": 8, "volume": 0 },
    "caustics": false,
    "motion_blur_shutter": 0
  },
  "world": {
    "color": "#87A8FF",
    "strength": 0.05,
    "sky": { "sun_elevation": 35, "sun_rotation": 20, "altitude": 0, "air": 1, "dust": 1, "ozone": 1, "sun_size": 0.545, "sun_intensity": 1 }
  },
  "camera": {
    "location": [0, -9, 3.2],
    "target": [0, 0, 0.6],
    "lens": 45,
    "fstop": 2.8,
    "sensor_width": 36,
    "channels": [
      {
        "prop": "target",
        "keys": [
          { "frame": 0, "value": [-0.4, 0, 0.6], "out": { "interpolation": "LINEAR", "easing": "AUTO" } },
          { "frame": 11, "value": [0.4, 0, 0.6], "out": null }
        ]
      }
    ]
  },
  "lights": [
    {
      "id": "sun", "type": "SUN", "shape": "DISK", "size": 1, "size_y": 1, "energy": 1.2, "color": "#FFF1DD",
      "location": [5, -5, 8], "target": [0, 0, 0], "spot_size": 45, "angle": 2.0, "channels": []
    },
    {
      "id": "bulb", "type": "POINT", "shape": "DISK", "size": 0.3, "size_y": 0.3, "energy": 150, "color": "#FFB38A",
      "location": [-3, -2, 2.5], "target": [0, 0, 0], "spot_size": 45, "angle": 0.526, "channels": []
    },
    {
      "id": "spot", "type": "SPOT", "shape": "DISK", "size": 0.2, "size_y": 0.2, "energy": 400, "color": "#9FD0FF",
      "location": [3, -1, 4], "target": [1, 0, 0], "spot_size": 40, "angle": 0.526,
      "channels": [
        {
          "prop": "target",
          "keys": [
            { "frame": 0, "value": [1, 0, 0], "out": { "interpolation": "BEZIER", "easing": "AUTO" } },
            { "frame": 11, "value": [-1, 0, 0], "out": null }
          ]
        }
      ]
    },
    {
      "id": "strip", "type": "AREA", "shape": "RECTANGLE", "size": 4, "size_y": 0.5, "energy": 200, "color": "#FFFFFF",
      "location": [0, 3, 3], "target": [0, 0, 0.5], "spot_size": 45, "angle": 0.526, "channels": []
    }
  ],
  "objects": [
    {
      "id": "floor", "primitive": "plane", "size": 12, "minor": 0.25, "bevel": 0,
      "location": [0, 0, 0], "rotation": [0, 0, 0], "scale": [1, 1, 1],
      "material": {
        "name": "floor_mat", "base_color": "#D9D9D9", "roughness": 0.7, "metallic": 0, "specular": 0.5,
        "sheen": 0, "sheen_roughness": 0.5, "coat": 0, "coat_roughness": 0.03, "subsurface": 0, "transmission": 0,
        "ior": 1.45, "anisotropic": 0, "emission": "#000000", "emission_strength": 0
      },
      "channels": []
    },
    {
      "id": "cube", "primitive": "cube", "size": 0.8, "minor": 0.25, "bevel": 0,
      "location": [-2.4, 0.5, 0.4], "rotation": [0, 0, 25], "scale": [1, 1, 1],
      "material": {
        "name": "metal", "base_color": "#C0C4CC", "roughness": 0.25, "metallic": 1, "specular": 0.5,
        "sheen": 0, "sheen_roughness": 0.5, "coat": 0, "coat_roughness": 0.03, "subsurface": 0, "transmission": 0,
        "ior": 1.45, "anisotropic": 0.5, "emission": "#000000", "emission_strength": 0
      },
      "channels": [
        {
          "prop": "rotation",
          "keys": [
            { "frame": 0, "value": [0, 0, 25], "out": { "interpolation": "ELASTIC", "easing": "EASE_OUT", "amplitude": 0, "period": 3.3 } },
            { "frame": 11, "value": [0, 0, 115], "out": null }
          ]
        }
      ]
    },
    {
      "id": "pillar", "primitive": "cylinder", "size": 0.7, "minor": 0.25, "bevel": 0,
      "location": [-1.2, 0.8, 0.35], "rotation": [0, 0, 0], "scale": [1, 1, 1.6],
      "material": {
        "name": "glass", "base_color": "#FFFFFF", "roughness": 0.05, "metallic": 0, "specular": 0.5,
        "sheen": 0, "sheen_roughness": 0.5, "coat": 0, "coat_roughness": 0.03, "subsurface": 0, "transmission": 1,
        "ior": 1.5, "anisotropic": 0, "emission": "#000000", "emission_strength": 0
      },
      "channels": [
        { "prop": "location", "keys": [ { "frame": 0, "value": [-1.2, 0.8, 0.56], "out": null } ] }
      ]
    },
    {
      "id": "spike", "primitive": "cone", "size": 0.8, "minor": 0.25, "bevel": 0,
      "location": [0, 0.6, 0.4], "rotation": [0, 0, 0], "scale": [1, 1, 1],
      "material": {
        "name": "neon", "base_color": "#222222", "roughness": 0.5, "metallic": 0, "specular": 0.5,
        "sheen": 0, "sheen_roughness": 0.5, "coat": 0, "coat_roughness": 0.03, "subsurface": 0, "transmission": 0,
        "ior": 1.45, "anisotropic": 0, "emission": "#FF3AD0", "emission_strength": 3
      },
      "channels": [
        {
          "prop": "location",
          "keys": [
            { "frame": 0, "value": [0, 0.6, 1.6], "out": { "interpolation": "BOUNCE", "easing": "EASE_OUT" } },
            { "frame": 8.5, "value": [0, 0.6, 0.4], "out": null }
          ]
        }
      ]
    },
    {
      "id": "pebble", "primitive": "sphere", "size": 0.7, "minor": 0.25, "bevel": 0,
      "location": [1.2, 0.2, 0.35], "rotation": [0, 0, 0], "scale": [1, 1, 1],
      "material": {
        "name": "wax", "base_color": "#F2E3C9", "roughness": 0.4, "metallic": 0, "specular": 0.5,
        "sheen": 0, "sheen_roughness": 0.5, "coat": 0.5, "coat_roughness": 0.05, "subsurface": 0.3, "transmission": 0,
        "ior": 1.45, "anisotropic": 0, "emission": "#000000", "emission_strength": 0
      },
      "channels": [
        {
          "prop": "scale",
          "keys": [
            { "frame": 0, "value": [1, 1, 1], "out": { "interpolation": "CONSTANT", "easing": "AUTO" } },
            { "frame": 6, "value": [1.3, 1.3, 1.3], "out": null }
          ]
        }
      ]
    },
    {
      "id": "dice", "primitive": "rounded_cube", "size": 0.7, "minor": 0.25, "bevel": 0.1,
      "location": [2.4, 0.4, 0.35], "rotation": [0, 0, -30], "scale": [1, 1, 1],
      "material": {
        "name": "wax", "base_color": "#F2E3C9", "roughness": 0.4, "metallic": 0, "specular": 0.5,
        "sheen": 0, "sheen_roughness": 0.5, "coat": 0.5, "coat_roughness": 0.05, "subsurface": 0.3, "transmission": 0,
        "ior": 1.45, "anisotropic": 0, "emission": "#000000", "emission_strength": 0
      },
      "channels": []
    },
    {
      "id": "hoop", "primitive": "torus", "size": 1.4, "minor": 0.08, "bevel": 0,
      "location": [0, 1.8, 0.08], "rotation": [0, 0, 0], "scale": [1, 1, 1],
      "material": {
        "name": "hoop_mat", "base_color": "#FFB000", "roughness": 0.2, "metallic": 1, "specular": 0.5,
        "sheen": 0, "sheen_roughness": 0.5, "coat": 0, "coat_roughness": 0.03, "subsurface": 0, "transmission": 0,
        "ior": 1.45, "anisotropic": 0, "emission": "#000000", "emission_strength": 0
      },
      "channels": []
    }
  ]
}
